global_row,name,barcode,quantityUnitType,salesPrice,productDesc,category,brand,productImg
4659,Шоколад Казахстанский BS 100гр,4870200143748,pcs,835.00,Натуральный шоколад из Казахстана.,BAR_SNACKS,,
4662,Печенье Яшкино Puffitoчерная смородина 125гр,4620017455349,pcs,400.00,Хрустящее печенье с начинкой из черной смородины.,BAR_SNACKS,Яшкино,
4665,Печенье Яшкино Десерт шок с вишней 165гр,4630026561849,pcs,435.00,Вкусное печенье с шоколадом и вишней.,BAR_SNACKS,Яшкино,
4668,"Молочный шоколад Ozera Extra Milk Hazelnut, 90 г",4600452021149,pcs,555.00,Нежный молочный шоколад с орехами.,BAR_SNACKS,Ozera,
4671,"Малиновый закат, 3 кг",2500603540012,pcs,2015.00,Сладкий десерт с малиновым вкусом.,BAR_SNACKS,,
4674,"Печенье OREO с какао и кремовой начинкой, 38 г",7622210375735,pcs,285.00,Популярное печенье с кремом и какао.,BAR_SNACKS,OREO,
4677,Шоколад Казахстанский BS 420гр,4870200149788,pcs,3400.00,Качественный шоколад из Казахстана.,BAR_SNACKS,,
4680,Пирожки с черемухой,2500803980014,kg,3325.00,Вкусные пирожки с начинкой из черемухи.,BAR_SNACKS,,
4683,"Ирис ""Сливочный"" 180гр",4870004420847,pcs,535.00,Сладкие ирисы с кремовым вкусом.,BAR_SNACKS,,
4686,Зефир Бело-Розовый 300гр,4870004451506,pcs,810.00,Нежный зефир с бело-розовым оттенком.,BAR_SNACKS,,
4689,Арбузный леденцы 17гх30шт,6947026600309,pcs,150.00,Леденцы со вкусом арбуза в упаковке по 30 штук.,BAR_SNACKS,,
4692,Жевательные конфеты в шоколаде имбирь-черная смородина 35 г,4610091720778,pcs,265.00,Конфеты с имбирем и черной смородиной в шоколадной оболочке.,BAR_SNACKS,,
4695,Печенье Мадлен,2500605070012,pcs,960.00,Нежное печенье в форме мадлен.,BAR_SNACKS,,
4698,Ассорти вафли с орехами,2500605130013,pcs,1920.00,Ассорти вафель с ореховой начинкой.,BAR_SNACKS,,
4701,Шоколад Казахстанский 100гр,4870028006041,pcs,835.00,Шоколад из Казахстана с насыщенным вкусом.,BAR_SNACKS,Казахстанский,
4704,Пористый темный шоколад Classic 65 г,4660013947097,pcs,380.00,Темный шоколад с пористой текстурой.,BAR_SNACKS,Classic,
4707,"Орешки ( фас 0,300 г ) Маскон",4870203571944,pcs,1160.00,Смешанные орехи в упаковке 300 г.,BAR_SNACKS,Маскон,
4710,Трюфель 12х135гр,8698701031670,pcs,2285.00,"Трюфели в упаковке по 12 штук, вес 135 г.",BAR_SNACKS,,
4713,Вафли Сэндвич Яшкино с ореховой начинкой 168 г,4670161192133,pcs,550.00,Вафли с ореховой начинкой от Яшкино.,BAR_SNACKS,Яшкино,
4716,Цикорий Клюква 100гр,4650100194787,pcs,730.00,Цикорий с добавлением клюквы.,BAR_SNACKS,,
4719,Цикорий Черника 100гр,4650100194732,pcs,730.00,Цикорий с добавлением черники.,BAR_SNACKS,,
4722,Печенье к кофе с какао,2500805810012,kg,1820.00,"Печенье с какао, идеально подходит к кофе.",BAR_SNACKS,,
4725,Сушки ванильные 500гр,4680037381066,kg,575.00,"Хрустящие ванильные сушки, идеальны к чаю.",BAR_SNACKS,,
4728,"Оливки б/к ТМ ""Стоевь"" ж/б 280гр",4607116767030,kg,1125.00,"Оливки без косточек, идеальны для салатов и закусок.",BAR_SNACKS,Стоевь,
4731,"Зефир с Ароматом ванили 0,110гр",4870203570015,pcs,385.00,Нежный зефир с ванильным ароматом.,BAR_SNACKS,,
4734,Батончик NUT@GO Фисташки и кешью с малиной,4680167312497,pcs,280.00,Энергетический батончик с фисташками и кешью.,BAR_SNACKS,NUT@GO,
4737,Коробочные Конфеты Roshen Assortment Elegant ВКФ 145гр,4823077611933,pcs,2225.00,"Ассорти конфет от Roshen, идеальны для подарка.",BAR_SNACKS,Roshen,
4740,Вафли Roshen Wafers Орех ККФ 216гр,4823077625626,pcs,520.00,Хрустящие вафли с ореховой начинкой.,BAR_SNACKS,Roshen,
4743,Вафли Roshen Wafers Какао ККФ 216гр,4823077641312,pcs,520.00,Вафли с насыщенным вкусом какао.,BAR_SNACKS,Roshen,
4746,Halley Банан 336 г,4870112008432,pcs,1625.00,Сладости с банановым вкусом от Halley.,BAR_SNACKS,Halley,
4749,Кекс с изюмом вес,2500608130010,kg,2230.00,"Вкусный кекс с изюмом, идеален к чаю.",BAR_SNACKS,,
4752,Бауырсаки соломка 195 г,4870213710012,pcs,515.00,Традиционные казахские сладости.,BAR_SNACKS,,
4755,Молочный шоколад Нестле Миндаль и изюм 75 г,4600680016740,pcs,1055.00,Шоколад с миндалем и изюмом от Нестле.,BAR_SNACKS,Нестле,
4758,Вафельные рожки Aico,2501601290015 7216880099628,pcs,1000.00,Хрустящие вафельные рожки для мороженого.,BAR_SNACKS,Aico,
4761,Эклеры Aico,2110000014810 7216880099864,pcs,1625.00,Нежные эклеры с кремом от Aico.,BAR_SNACKS,Aico,
4764,Чак-Чак Aico,2501505350013 7216880099482,pcs,815.00,Сладкое лакомство Чак-Чак от Aico.,BAR_SNACKS,Aico,
4767,Вафельная трубочка Маскон вес,2500608670011,kg,2620.00,"Хрустящие вафельные трубочки, идеальны для десертов.",BAR_SNACKS,,
4770,"Арахис (Жареный, Соленый) 60гр",710497221146,pcs,255.00,Соленый жареный арахис в упаковке 60 г.,BAR_SNACKS,,
4773,Печенье OREO 228 г с начинкой шоколадного вкуса,7622202204135,pcs,1365.00,"Печенье OREO с шоколадной начинкой, 228 г.",BAR_SNACKS,OREO,
4776,Kovis Мини-маффины ягодные ассорти 200 г,96146509 4607001416456,pcs,650.00,"Мини-маффины с ягодами, 200 г.",BAR_SNACKS,Kovis,
4779,Печенье с карамелью Albeni mini,2500609820019,pcs,680.00,Печенье с карамелью Albeni mini.,BAR_SNACKS,Albeni,
4782,Вупи пай,2500700200017,pcs,1000.00,Вупи пай — сладкий десерт.,BAR_SNACKS,,
4785,Трайфл,2500700230014,pcs,600.00,Трайфл — многослойный десерт.,BAR_SNACKS,,
4788,Печенье Crafers со вкусом инжира 300 г,4870111072146,pcs,1600.00,"Печенье Crafers со вкусом инжира, 300 г.",BAR_SNACKS,Crafers,
4791,Печенье Choco Break со вкусом кокоса 300 г,4870111070579,pcs,1790.00,"Печенье Choco Break со вкусом кокоса, 300 г.",BAR_SNACKS,Choco Break,
4794,Печенье Leo,4870066008885,pcs,875.00,Печенье Leo.,BAR_SNACKS,Leo,
4797,Тук 100гр. Паприка крекер,7622202203534,pcs,640.00,"Крекеры Тук со вкусом паприки, 100 г.",BAR_SNACKS,,
4800,Вафли Сэндвич Яшкино глазированные 168 г,2500808110010,pcs,470.00,"Глазированные вафли-сэндвичи Яшкино, 168 г.",BAR_SNACKS,Яшкино,
4803,Конфеты Крокант,2500808140017,pcs,1040.00,Конфеты Крокант.,BAR_SNACKS,,
4806,Конфеты романтического вечера 195 г,2500808170014,pcs,1700.00,"Конфеты для романтического вечера, 195 г.",BAR_SNACKS,,
4809,Прокладки дневные Day pads,4580682380011,pcs,1135.00,Дневные прокладки Day pads.,BAR_SNACKS,,
4812,Печенье Маскон Хрустик 1 кг,2500808260012,kg,1945.00,"Печенье Маскон Хрустик, 1 кг.",BAR_SNACKS,Маскон,
4815,Конфеты Красная Шапочка,2500808290019 4870200144998,kg,4215.00,Сладкие конфеты с начинкой.,BAR_SNACKS,,
4818,Изюм,2500808420010,kg,8470.00,"Сухофрукты, богатые витаминами.",BAR_SNACKS,,
4821,Конфеты Алтын Кум,4870208431854,kg,4485.00,Сладости с орехами.,BAR_SNACKS,,
4824,Сушка к Чаю 200гр,4607074601803,kg,380.00,Хрустящие сушки для чая.,BAR_SNACKS,,
4827,"Соус ТМ ""Стоевь"" Кавказский острый п/бут 200гр",4607116769478,kg,450.00,Острый соус для блюд.,BAR_SNACKS,Стоевь,
4830,Jin Ramen (HOT) Спайси 120 г,8801045520124,kg,610.00,Острая лапша быстрого приготовления.,BAR_SNACKS,,
4833,Конфеты Флоренц шоколадно-ореховый,2500809260011,kg,4815.00,Шоколадные конфеты с орехами.,BAR_SNACKS,,
4836,"Черная смородина протертая с сахаром ТМ ""Стоевь"" д/п 270гр",4670025504423,kg,830.00,Протертая смородина с сахаром.,BAR_SNACKS,Стоевь,
4839,"Ежедневные прокладки 18 см, 16 шт",4580682380035,pcs,1125.00,Гигиенические прокладки для женщин.,BAR_SNACKS,,
4842,Туалетная бумага 5 элемент 1*40,4870215460014,pcs,220.00,Мягкая туалетная бумага.,BAR_SNACKS,,
4845,"Немецкий пирог ""KUCHEN"" Шоколадный 350гр",4607001416159,pcs,1865.00,Шоколадный пирог по немецкому рецепту.,BAR_SNACKS,,
4848,Вафли Яшкино Голландские 165гр Карамаель нач,4630026562372,pcs,410.00,Хрустящие вафли с начинкой.,BAR_SNACKS,Яшкино,
4851,Battega del Sole Макарон г. в Рожки 400гр,4690329010765,pcs,300.00,Макароны в форме рожков.,BAR_SNACKS,Battega del Sole,
4854,Battega del Sole Макарон г. в Спагетти 400гр,4690329010932,pcs,360.00,Макароны в форме спагетти.,BAR_SNACKS,Battega del Sole,
4857,"Сырное печенье фас 0,350 кг",4870203571548,pcs,590.00,Хрустящее печенье с сыром.,BAR_SNACKS,,
4860,Фрутто джем,2500700890010,kg,2195.00,Вкусный джем для тостов и десертов.,BAR_SNACKS,Фрутто,
4863,Набор конфет Ferrero Т15х6,8000500247150,pcs,4285.00,Ассорти конфет Ferrero в удобной упаковке.,BAR_SNACKS,,
4866,Конфеты Красный мак,4870200144868,kg,3780.00,Сладкие конфеты с уникальным вкусом.,BAR_SNACKS,Красный мак,
4869,Конфета Несси,4620017454861,pcs,720.00,Сладкая конфета с оригинальным вкусом.,BAR_SNACKS,Несси,
4872,Кекс Маскон Абрикосовый,2500901270017,kg,2225.00,Вкусный абрикосовый кекс для перекуса.,BAR_SNACKS,Маскон,
4875,"Жевательные конфеты Мамба 79,5 г",40144306,pcs,795.00,Жевательные конфеты с фруктовым вкусом.,BAR_SNACKS,Мамба,
4878,Печенье Султан Choco-Pir 360 г,4870144023274,pcs,1670.00,Хрустящее печенье с шоколадной начинкой.,BAR_SNACKS,Султан,
4881,Печенье Фаготтини с яблочным джемом 125 г,2500902290014,pcs,425.00,Печенье с яблочным джемом для сладкого перекуса.,BAR_SNACKS,Фаготтини,
4884,Жевательная резинка Orbit Tropic Refreshers 16 г,4660085511462,pcs,330.00,Жевательная резинка с тропическим вкусом.,BAR_SNACKS,Orbit,
4887,Малиновый пай голландский 150 г,4620017457978,pcs,370.00,Вкусный малиновый пай для десерта.,BAR_SNACKS,,
4890,"Напиток шоколадный Нэсквик 32х13,5 г",46258175,pcs,175.00,Шоколадный напиток для детей и взрослых.,BAR_SNACKS,,
4893,Печенье Зебра с топлёным молоком,2500703860010,kg,1560.00,Сладкое печенье с молочной начинкой.,BAR_SNACKS,,
4896,Печенье Маскон к кофе 210гр,4870203571586,pcs,350.00,"Печенье, идеально подходящее к кофе.",BAR_SNACKS,Маскон,
4899,Сладкий подарок Новый год,2500704310019,pcs,2650.00,Сладкий набор для праздника.,BAR_SNACKS,,
4902,"Соломка с маком ""Для младшего братишки"" 200гр",4607074602114,kg,620.00,Соломка с маком для сладкого перекуса.,BAR_SNACKS,,
4905,"Уксус ТМ ""Стоевь"" Рисовый 3% п/бут 970 мл",4670025505086,kg,1360.00,Рисовый уксус с низким содержанием кислоты.,BAR_SNACKS,Стоевь,
4908,"Печ Рахат Алматинское ф/пчк 0,220гр. (22)",4870099003031,pcs,320.00,Алматинское печенье с начинкой.,BAR_SNACKS,Рахат,
4911,"Пряник Сан Бана 5,4 кг",4607001473848,kg,755.00,Большой пряник с насыщенным вкусом.,BAR_SNACKS,Сан Бана,
4914,АГ 37 г Спец Цена Орео белый шоколад с начинкой со вкусом ванили и кусочками печенье,7622202260186,pcs,330.00,,BAR_SNACKS,,
4917,Мучные кондитерские изделия глазированные Tondi Клубника 180 г,4620017459378,pcs,575.00,Глазированные кондитерские изделия с клубничным вкусом.,BAR_SNACKS,Tondi,
4920,Вафли Twiggy DOUBLE с кокосом в белом шоколаде 185 г,4620017458548,pcs,685.00,Хрустящие вафли с кокосовой начинкой.,BAR_SNACKS,Twiggy,
4923,Печенье Маскон Кнопка 250гр,4870203571975,pcs,540.00,Хрустящее печенье с уникальным вкусом.,BAR_SNACKS,Маскон,
4926,Палочки классические Талас 50гр,2500706220019,pcs,505.00,Классические палочки для закусок.,BAR_SNACKS,Талас,
4929,"Воздушная пщеница ""На здоровье"" со вкусом шоколада 100гр",4601159075114,pcs,310.00,Легкая закуска с шоколадным вкусом.,BAR_SNACKS,На здоровье,
4932,"Хлопья овсяные ""Каша минутка"" 215гр с черной смородиной и сливками",4601159073394,pcs,685.00,Быстрая каша с ягодами и сливками.,BAR_SNACKS,Каша минутка,
4935,Бельгийские вафли Яшикино 200 г,4680167312862,pcs,595.00,Вафли с характерным бельгийским вкусом.,BAR_SNACKS,Яшикино,
4938,Печенье Crafers со вкусом манго и маракуйи 300 г,4780111070227,pcs,1600.00,Сладкое печенье с экзотическим вкусом.,BAR_SNACKS,Crafers,
4941,Печенье Crafers с шоколадно-ореховой начинкой 300 г,4780059609367,pcs,1600.00,Печенье с шоколадной начинкой и орехами.,BAR_SNACKS,Crafers,
4944,Лапша Рамен БОДЫЛ с сыром,8801045525365,pcs,790.00,Вкусная лапша с сырным вкусом.,BAR_SNACKS,БОДЫЛ,
4947,"Дирол Арбуз-Дыня 2,72 г",4600815001030,pcs,40.00,Жевательная резинка с фруктовым вкусом.,BAR_SNACKS,Дирол,
4950,Желтополос селар желтый полосатик 40 г,4607120853576,pcs,470.00,Сухая закуска с ярким вкусом.,BAR_SNACKS,Beerka,
4953,Филе минтая ломтики 25 г,4690329002500,pcs,255.00,Полезная закуска из рыбы.,BAR_SNACKS,Beerka,
4956,Beerka Север путассу Янтарная филе соломка 25 г,4607120854924,pcs,255.00,Сухая закуска из рыбы.,BAR_SNACKS,Beerka,
4959,Сыр твердый Президент 50%,4823065731865,pcs,1710.00,Натуральный сыр с высоким содержанием жира.,BAR_SNACKS,Gouda,
4962,Пряник Северные 250гр,4870004420274,pcs,515.00,Вкусный пряник с медом и специями.,BAR_SNACKS,,
4965,СУХАРЬ ВАНИЛЬНЫЙ СДОБНЫЙ 300гр,4603725417137,pcs,750.00,Хрустящий сухарь с ванильным вкусом.,BAR_SNACKS,,
4968,Арахис 30 г,4607120854177,pcs,120.00,Соленый арахис для перекуса.,BAR_SNACKS,BEERKa,
4971,Конфеты Toffifee 125гр Белый шоколад,4014400932959,pcs,1630.00,Шоколадные конфеты с орехами и карамелью.,BAR_SNACKS,,
4974,Сырное печенье Маскон,2500909600014,kg,1235.00,Хрустящее печенье с сыром.,BAR_SNACKS,,
4977,Гвоздика 10 г,745125382067,pcs,280.00,Специя для придания аромата блюдам.,BAR_STAPLES,,
4980,Приправа Имбирь молотый Выбор Шефа 15 г,745125381923,pcs,135.00,Специя с острым вкусом и ароматом.,BAR_STAPLES,,
4983,Приправа Каркаде Выбор Шефа 70 г,745125381268,pcs,570.00,Чай из цветков гибискуса.,BAR_STAPLES,,
4986,Крахмал картофельный 40 г,0745125381183 745125381183,pcs,175.00,Кулинарный крахмал для загустения.,BAR_STAPLES,,
4989,Кунжут 100 г,745125381916,pcs,635.00,Семена кунжута для добавления в блюда.,BAR_STAPLES,,
4992,Лавровый лист 50 г,745125381237,pcs,515.00,Специя для ароматизации блюд.,BAR_STAPLES,,
4995,Мороженое Бабл Гам 80 г,710497627009,pcs,620.00,Сладкое мороженое с вкусом жевательной резинки.,BAR_STAPLES,,
4998,Мороженое Шоколадное 80 г,745125382128,pcs,600.00,Классическое шоколадное мороженое.,BAR_STAPLES,,
5001,Паприка Молотая Выбор Шефа 50 г,0745125381381 745125381381,pcs,475.00,Молотая паприка для добавления в блюда.,BAR_STAPLES,Выбор Шефа,
5004,Перец Черный Молотый Выбор Шефа 50 г,0745125381411 745125381411,pcs,320.00,Молотый черный перец для приправы.,BAR_STAPLES,Выбор Шефа,
5007,Паприка 100 Блюд 20 г,0745125381541 745125381541,pcs,105.00,Паприка для приготовления различных блюд.,BAR_STAPLES,,
5010,Универсальная Приправа 12 Овощей и Трав 120 г,745125381466,pcs,445.00,Приправа с 12 овощами и травами для разнообразия блюд.,BAR_STAPLES,,
5013,Приправа Универсальная Дой-Пак 120 г,745125381459,pcs,445.00,Универсальная приправа в упаковке Дой-Пак.,BAR_STAPLES,,
5016,Приправа для Лагмана Выбор Шефа 20 г,745125381619,pcs,105.00,Приправа для приготовления лагмана.,BAR_STAPLES,Выбор Шефа,
5019,Приправа для Плова Выбор Шефа 20 г,745125381510,pcs,110.00,Приправа для плова.,BAR_STAPLES,Выбор Шефа,
5022,Приправа для Шашлыка 20 г,745125381503,pcs,120.00,Приправа для шашлыка.,BAR_STAPLES,,
5025,Разрыхлитель Выбор Шефа 15 г,745125381244,pcs,130.00,Разрыхлитель для теста.,BAR_STAPLES,Выбор Шефа,
5028,Сахарная Пудра Выбор Шефа 40 г,0745125381596 745125381596,pcs,170.00,Сахарная пудра для выпечки и десертов.,BAR_STAPLES,Выбор Шефа,
5031,Цикорий Классик 80 г,745125382098,pcs,645.00,Цикорий для приготовления напитков.,BAR_STAPLES,,
5034,Приправа Черный Перец Горошек Выбор Шефа 40 г,745125381275,pcs,635.00,Приправа из черного перца горошком.,BAR_STAPLES,Выбор Шефа,
5037,Фунчоза 400 г,745125381763,pcs,865.00,Фунчоза для приготовления блюд восточной кухни.,BAR_STAPLES,,
5040,Говяжий бульон на косточке 48 х 10 г,84103222,pcs,35.00,Приправа для приготовления бульона.,BAR_STAPLES,GB,
5043,Куриные ножки с чесноком 36 г,8410300363491,pcs,510.00,Смесь для вторых блюд.,BAR_STAPLES,GB,
5046,Приправа GB Грибной рассыпчатый бульон 90гр,8410300356158,pcs,270.00,Приправа для супов и соусов.,BAR_STAPLES,GB,
5049,Кетчуп Итальянский дой-пак 320 г,4601674084776,pcs,910.00,Кетчуп для подачи к блюдам.,BAR_STAPLES,Heinz,
5052,Подсолнечное масло Олейна 1 л,4607083550482,pcs,1035.00,Масло для жарки и салатов.,BAR_STAPLES,Олейна,
5055,Выбор Шефа 50 г,710497627016,pcs,310.00,Приправа для блюд.,BAR_STAPLES,Доржжи,
5058,Соль Барские» продукты пищевая Йодированная 1 кг,4870235043471,pcs,110.00,Соль для повседневного использования.,BAR_STAPLES,,
5061,Сухие сливки 450 г,4870006486964,pcs,1355.00,Сливки для кофе и десертов.,BAR_STAPLES,Дуденко,
5064,Цикорий с шиповником 80 г,4870006487978,pcs,515.00,Напиток для здоровья.,BAR_STAPLES,,
5067,Сочни для бесбармака 250 г,4870003711007,pcs,350.00,Тесто для традиционного блюда.,BAR_STAPLES,Лия,
5070,Фунчоза Ашлянфу,6922434900036,pcs,600.00,Лапша для приготовления блюд.,BAR_STAPLES,Ашлянфу,
5073,Уксус 70% 160 г,4600595007628,pcs,385.00,Уксус для маринадов.,BAR_STAPLES,Дуденко,
5076,Соль Арал 1 кг,4870001130015,pcs,150.00,Соль для повседневного использования.,BAR_STAPLES,,
5079,Ванилин фас Приправыч1 г,4610000823446,pcs,105.00,Ароматизатор для выпечки.,BAR_STAPLES,Приправыч,
5082,Горчичный порошок 50 г,4610000820520,pcs,175.00,Приправа для блюд.,BAR_STAPLES,,
5085,Желе апельсиновое 100 г,4630019132469,pcs,400.00,Сладкое желе с вкусом апельсина.,BAR_STAPLES,,
5088,"Бульон со вкусом ""Домашний куриный"" ""Роллтон "" (90r)",4870227270052 4870227270274,pcs,210.00,Бульон со вкусом домашнего куриного бульона.,BAR_STAPLES,Роллтон,
5091,Желе лесное ягоды 100 г,4630019132513,pcs,400.00,Желе со вкусом лесных ягод.,BAR_STAPLES,,
5094,Кисель абрикосовый 110 г,4610000823262,pcs,270.00,Кисель с вкусом абрикоса.,BAR_STAPLES,,
5097,Кисель земляничный 110 г,4610000820209,pcs,270.00,Кисель со вкусом земляники.,BAR_STAPLES,,
5100,Кориандр молотый 15 г,4610000822890,pcs,100.00,Молотый кориандр для приправ.,BAR_STAPLES,,
5103,"Корица молотая ""Приправыч"" 10 г",4610000822876,pcs,190.00,Молотая корица для выпечки и десертов.,BAR_STAPLES,Приправыч,
5106,Кукуруза попкорн 100 г,4610000821022,pcs,200.00,Попкорн из кукурузы.,BAR_STAPLES,,
5109,Куркума молотая 20 г,4610000824528,pcs,150.00,Молотая куркума для приправ.,BAR_STAPLES,,
5112,Лавровый лист 30 г,4610000823774,pcs,565.00,Сушеный лавровый лист для приправ.,BAR_STAPLES,,
5115,Лук зеленый сушеный 5 г,4610000820988,pcs,130.00,Сушеный зеленый лук для приправ.,BAR_STAPLES,,
5118,Мороженое клубничное 70 г,4630019132834,pcs,410.00,Клубничное мороженое.,BAR_STAPLES,,
5121,Мята перечная сушеная 6 г,4630019133152,pcs,120.00,Сушеная перечная мята для чая и десертов.,BAR_STAPLES,,
5124,Орегано сушеная зелень 6 г,4610000826034,pcs,110.00,Сушеная зелень орегано для приправ.,BAR_STAPLES,,
