global_row,name,barcode,quantityUnitType,salesPrice,productDesc,category,brand,productImg
6990,Белочка эск с змж ван в гл с арах 70гр*26,4870233466838,pcs,370.00,Вкусный десерт с арахисом.,BAR_SNACKS,,
6993,Бомба вафельный стакан с шоколадом 90 г,4870233466456,pcs,290.00,Вафельный стакан с шоколадной начинкой.,BAR_SNACKS,,
6996,Бомба Эскимо шоколадное печенье 90гр*30,4870004906914,pcs,430.00,Шоколадное эскимо с печеньем.,BAR_SNACKS,,
6999,Миша Ванна мор с змж 12% ван 450гр*12,4870233466555,pcs,2250.00,Мороженое с ванильным вкусом.,BAR_SNACKS,,
7002,Миша пакет пломб ваниль 400гр 12,4870233460232 4870233466395,pcs,1375.00,Пломбир с ванильным вкусом.,BAR_SNACKS,,
7005,Мишка на полюсе ваф ст пломб фисташ 80гр*27 (РФ),4870233467514,pcs,500.00,Вафельный стакан с фисташковым мороженым.,BAR_SNACKS,,
7008,Мишка на полюсе эск пломб зефир в мяг шок 75гр*26 (КЗ),4870233461246,pcs,525.00,Пломбир с зефиром в шоколаде.,BAR_SNACKS,,
7011,Снеговик эск мор с эмж ван в rn 70rp*36 10,4870233467316,pcs,295.00,Мороженое с ванильным вкусом.,BAR_SNACKS,,
7014,Тесто слоен дрож Макс Размах 800гр,4870201000774,pcs,975.00,Слоёное тесто для выпечки.,BAR_SNACKS,,
7017,Пельмени говяж итальянс лепка Макс Размах 400гр,4870201000057,pcs,910.00,Пельмени с говяжьей начинкой.,BAR_SNACKS,,
7020,Пельмени говяжьи люкс Макс Размах 1 кг,4870201000484,pcs,1820.00,"Пельмени с говядиной, премиум качество.",BAR_SNACKS,Макс Размах,
7023,Мороженое Ностальгия Шоколадное 500 г,4870007233321,pcs,1615.00,"Шоколадное мороженое, 500 г.",BAR_SNACKS,Ностальгия,
7026,Мороженое Ностальгия в пергаменте 80 г,4870007231655,pcs,360.00,"Мороженое в пергаментной упаковке, 80 г.",BAR_SNACKS,Ностальгия,
7029,Мороженое Ностальгия сливочное 500 г,4870007232928,pcs,1615.00,"Сливочное мороженое, 500 г.",BAR_SNACKS,Ностальгия,
7032,Мороженое Ностальгия соленый Арахис 80гр,4870007234793,pcs,745.00,"Мороженое со вкусом солёного арахиса, 80 г.",BAR_SNACKS,Ностальгия,
7035,Филе Утки 600 г. Султан-Ата.,4870001029418,pcs,1955.00,"Филе утки, 600 г.",BAR_SNACKS,Султан-Ата,
7038,Пельмени Народные Astana Meat 800гр,2700038008006,pcs,1690.00,"Пельмени, 800 г.",BAR_SNACKS,Astana Meat,
7041,Пельмени Народные Astana Meat 400гр,731093261503,pcs,845.00,"Пельмени, 400 г.",BAR_SNACKS,Astana Meat,
7044,Лагман Astana Meat 1 кг,2700046010008,pcs,1430.00,"Лагман, 1 кг.",BAR_SNACKS,Astana Meat,
7047,PL Зелёный горошек 400 г,5907431381638,pcs,1125.00,"Зелёный горошек, 400 г.",BAR_SNACKS,,
7050,PL Клубника с/м 400 г,5907431380198,pcs,1615.00,"Клубника, замороженная, 400 г.",BAR_SNACKS,,
7053,PL Овощи на сковородку с парижской приправой 450 г,5907431383441,pcs,1430.00,"Овощи для жарки с парижской приправой, 450 г.",BAR_SNACKS,,
7056,PL Овощная смесь 7 450 г,5907431383205,pcs,1180.00,"Овощная смесь, 450 г.",BAR_SNACKS,,
7059,PL Смесь китайская 450 г,5907431382727,pcs,1325.00,"Китайская овощная смесь, 450 г.",BAR_SNACKS,,
7062,PL Цветная капуста 400 г,5907431381669,pcs,1160.00,"Цветная капуста, 400 г.",BAR_SNACKS,,
7065,Шпинат листовой резаный,5907431382185,pcs,1135.00,"Замороженный шпинат, готовый к использованию.",BAR_SNACKS,,
7068,Вареники с картофелем и рыбой 450 г,4870200302701,pcs,755.00,"Вареники с картофелем и рыбой, замороженные.",BAR_SNACKS,,
7071,В ЕД Вишня 300 г. (20),4607070250968,pcs,1155.00,"Замороженная вишня, готовая к использованию.",BAR_SNACKS,,
7074,ПВ ЕД Облепиха 300 г. (20),4607070251583,pcs,1155.00,"Замороженная облепиха, готовая к использованию.",BAR_SNACKS,,
7077,Клюква 300 г,4607070252337,pcs,1920.00,"Замороженная клюква, готовая к использованию.",BAR_SNACKS,,
7080,Пельмени GAJAP из говядины 800 г,4870200302459,pcs,3070.00,"Пельмени с мясом говядины, замороженные.",BAR_SNACKS,GAJAP,
7083,Пельмени Домашние из говядины 900 г,4870200301353,pcs,2150.00,"Пельмени с мясом говядины, замороженные.",BAR_SNACKS,,
7086,Правила Вкусов Клубника 40 г,4811519001770,pcs,1125.00,"Сухие клубничные снеки, 40 г.",BAR_SNACKS,Правила Вкусов,
7089,Правила Вкусов Фасоль стручковая 400 г,4811519001732,pcs,960.00,"Стручковая фасоль, замороженная, 400 г.",BAR_SNACKS,Правила Вкусов,
7092,"Тесто пирожковое 1,0 кг",487020030776 4870200300776,pcs,985.00,"Замороженное тесто для пирожков, 1 кг.",BAR_SNACKS,,
7095,Тесто слоеное пресное 500 г,4870200302046,pcs,675.00,"Замороженное слоеное тесто, 500 г.",BAR_SNACKS,,
7098,NOGGER sandwich 145 мл,8690637852053,pcs,645.00,"Мороженое в виде сэндвича, 145 мл.",BAR_SNACKS,Algida,
7101,Cornetto Classico Сливки 125 мл,8690637820052,pcs,585.00,"Мороженое в рожке с сливками, 125 мл.",BAR_SNACKS,Cornetto,
7104,Белый Шоколад 100 мл,8690637687433,pcs,760.00,"Мороженое с белым шоколадом, 100 мл.",BAR_SNACKS,Magnat,
7107,ALMOND миндаль 100 мл,8690637687662,pcs,760.00,"Мороженое с миндалем, 100 мл.",BAR_SNACKS,Magnat,
7110,Magnat Double Starchaser карамельный попкорн 85 мл,8683130038390,pcs,670.00,Карамельный попкорн в упаковке 85 мл.,BAR_SNACKS,Magnat,
7113,Magnat Mini Double Чёрный тутовник и ежевика-карамель 360 мл,8690637578953,pcs,3720.00,Мини-версия с чёрным тутовником и ежевикой в карамели.,BAR_SNACKS,Magnat,
7116,Мах TWISTER Океан 65 мл (30) 160 г,8690637900419,pcs,350.00,Охлаждающий напиток с океанским вкусом в упаковке 65 мл.,BAR_SNACKS,Мах,
7119,U13 весовое Золотой Стандарт Флоу-Пак шоколадный 800 мл 400 г (10),8683130073162,pcs,2325.00,Шоколадный десерт в упаковке Флоу-Пак 800 мл.,BAR_SNACKS,U13,
7122,U16 Золотой Стандарт Кубника 400 г,8683130073193,pcs,2960.00,Кубника в упаковке 400 г от Золотого Стандарта.,BAR_SNACKS,U16,
7125,U3 Золотой Стандарт черника WC KZK 160 мл,8683130060278,pcs,425.00,Черничный десерт в упаковке 160 мл от Золотого Стандарта.,BAR_SNACKS,U3,
7128,U7 Золотой Стандарт сендвич 135 мл,8683130065723,pcs,480.00,Сендвич в упаковке 135 мл от Золотого Стандарта.,BAR_SNACKS,U7,
7131,КП Б 5 Сендвич Пломбир на сливках 15% 76 г,4660013330790,pcs,640.00,Сендвич с пломбиром на сливках в упаковке 76 г.,BAR_SNACKS,,
7134,Вареники Обжоркино 500гр,4870002710087,pcs,650.00,Вареники в упаковке 500 г.,BAR_SNACKS,Обжоркино,
7137,Даниссимо Хрустящие шарики 130 г,4600605014509,pcs,510.00,Хрустящие шарики в упаковке 130 г.,BAR_SNACKS,Даниссимо,
7140,Даниссимо Хрустящие шарики 105 г,4600605019351,pcs,580.00,Хрустящие шарики в упаковке 105 г.,BAR_SNACKS,Даниссимо,
7143,Данон Персик 120 г,4870206414187,pcs,220.00,Йогурт с персиком в упаковке 120 г.,BAR_SNACKS,Данон,
7146,Пельмени Восточные говядина Гурман 450гр,4870202730014,pcs,1000.00,Восточные пельмени с говядиной в упаковке 450 г.,BAR_SNACKS,Гурман,
7149,Вареники с картоф и грибы Гурман 450гр,487020730052 4870202730052,pcs,590.00,Вареники с картофелем и грибами в упаковке 450 г.,BAR_SNACKS,Гурман,
7152,Мороженое Гормол Эскимо Шоколадное с орехами 80гр,4870212681320,pcs,650.00,Шоколадное эскимо с орехами в упаковке 80 г.,BAR_SNACKS,Гормол,
7155,Мороженое Гормол Рожок со вкусом сгущенки 90гр,4870212681207,pcs,585.00,Вкусное мороженое с сгущенкой в рожке.,BAR_SNACKS,Гормол,
7158,Мороженое Гормол Фисташка 900гр ведро,4870212680514,pcs,3500.00,Мороженое с фисташковым вкусом в ведре.,BAR_SNACKS,Гормол,
7161,Мороженое Гормол Шоколад 90гр Пингвин,4870001694746,pcs,300.00,Шоколадное мороженое в форме пингвина.,BAR_SNACKS,Гормол,
7164,Фрикадельки из океанских пород рыб в томатном соусе 240 г,4605463002989,pcs,540.00,Фрикадельки из рыбы в томатном соусе.,BAR_SNACKS,,
7167,Мороженое Bambino Венеция 140гр клубника,8,pcs,640.00,Мороженое с клубничным вкусом.,BAR_SNACKS,Bambino,
7170,Мороженое Bambino Венеция 140гр дыня,2500305190010,pcs,640.00,Мороженое с дынным вкусом.,BAR_SNACKS,Bambino,
7173,"Cornetto Classico Сливки 125 мл 78,5 г",2500307200014,pcs,,Классическое мороженое с сливками.,BAR_SNACKS,Cornetto,
7176,U2 со сгущенкой Золотой Стандарт 160 мл,8683130060292,pcs,420.00,Мороженое со сгущенкой в упаковке.,BAR_SNACKS,U2,
7179,"Мороженое Лед ""Зонтик"" в стакане",4870007231358,pcs,380.00,Мороженое в стакане в форме зонтика.,BAR_SNACKS,,
7182,Вареники с картофелем 800 г,2700033008001,pcs,1125.00,Вареники с картофелем в упаковке.,BAR_SNACKS,Astana Maat,
7185,Вареники с картофелем 400 г,731093261251,pcs,565.00,Вареники с картофелем в упаковке.,BAR_SNACKS,Astana Maat,
7188,Котлеты по-домашнему 400 г,731093261305,pcs,1030.00,Котлеты по-домашнему в упаковке.,BAR_SNACKS,Astana Maat,
7191,Нагетсы Куриные Классические 300гр Мироторг,4607177073095,pcs,1645.00,Классические куриные нагетсы.,BAR_SNACKS,Мироторг,
7194,Нагетсы Куриные хрустящие 300гр Мироторг,4607177073118,pcs,1645.00,Хрустящие куриные нагетсы.,BAR_SNACKS,Мироторг,
7197,Слоенное бездрожж тесто для самсы 900гр Мироторг,4870232760012,pcs,1280.00,Тесто для самсы в упаковке.,BAR_SNACKS,Мироторг,
7200,Сырники Алакай,4870251710111,pcs,1560.00,Вкусные сырники от Алакай.,BAR_SNACKS,,
7203,Рожок пломбир ванильный с шоколадом и карамелью 80г,4650068565254,pcs,450.00,Десерт в рожке с пломбиром и шоколадом.,BAR_SNACKS,,
7206,Рожок пломбир двойные сливки шоколад-вишня 100г,4650068565599,pcs,450.00,Двойные сливки с шоколадом и вишней.,BAR_SNACKS,,
7209,Эскимо Фиксики молочное с мармеладом кактус-фейхоа 60г,4630053637258,pcs,310.00,Молочное эскимо с мармеладом.,BAR_SNACKS,Фиксики,
7212,Эскимо Фиксики щербет яблоко-груша 60г,4630053637302,pcs,310.00,Щербет с яблоком и грушей.,BAR_SNACKS,Фиксики,
7215,Стакан пломбир на двойных сливках с шоколадной крошкой 70г,4650068563137,pcs,375.00,Пломбир на двойных сливках с шоколадом.,BAR_SNACKS,,
7218,Стакан пломбир на двойных сливках сгущенка 70г,4650068562284,pcs,375.00,Пломбир на двойных сливках со сгущенкой.,BAR_SNACKS,,
7221,Эскимо Pro Fit Vegan Персик-Яблоко,4650068564486,pcs,440.00,Веганское эскимо с персиком и яблоком.,BAR_SNACKS,Pro Fit,
7224,Страна вкусняшкино Гранат-Клюква 450гр,4650068565407,pcs,1015.00,Смесь граната и клюквы.,BAR_SNACKS,Страна вкусняшкино,
7227,Стакан Вкусняшкино Смородина 180г,4650068565155,pcs,600.00,Пластиковый стакан со смородиной.,BAR_SNACKS,Вкусняшкино,
7230,Эскимо ОЕ Лесной орех с фундуком и шоколадом 74г,4630053636244,pcs,585.00,Эскимо с лесным орехом и шоколадом.,BAR_SNACKS,ОЕ,
7233,Трубочка на сливочках с шоколадом 80г,4630053636275,pcs,470.00,Трубочка с шоколадом и сливками.,BAR_SNACKS,,
7236,Эскимо Лили Мили молочное манго-персик с черникой 60г,4630053637265,pcs,310.00,"Эскимо с манго, персиком и черникой.",BAR_SNACKS,Лили Мили,
7239,Фруктовый лед Арбуз-Дыня 60г,4630053636138,pcs,170.00,Лед с арбузом и дыней.,BAR_SNACKS,,
7242,Дессерт Грильяж-Шоколад 180г,4607065118518,pcs,715.00,Десерт с грильяжом и шоколадом.,BAR_SNACKS,,
7245,Страна Вкусняшкино Черника 450гр,4650068565391,pcs,1015.00,Сладкая черника в упаковке 450 г.,BAR_SNACKS,Страна Вкусняшкино,
7248,Снеговичок Ваниль 900гр,4630053630686,pcs,1820.00,Нежное ванильное мороженое в упаковке 900 г.,BAR_SNACKS,Снеговичок,
7251,Рожок Snackup Апельсин-Манго-Каламанси,4630053636923,pcs,440.00,"Мороженое в рожке с вкусом апельсина, манго и каламанси.",BAR_SNACKS,Snackup,
7254,Рожок инжир-миндаль 105 г,4870233467422,pcs,760.00,Мороженое в рожке с вкусом инжира и миндаля.,BAR_SNACKS,,
7257,Бон Пари Арбузик 67гр,4620021193640,pcs,560.00,Сладкое мороженое со вкусом арбуза в упаковке 67 г.,BAR_SNACKS,Бон Пари,
7260,Нагетсы с Индейкой 250гр,4607111035721,pcs,1320.00,Вкусные нагетсы с индейкой в упаковке 250 г.,BAR_SNACKS,,
7263,Чибупели ветчина с сыром 300гр,4607111033451,pcs,1300.00,Вкусные чибупели с ветчиной и сыром в упаковке 300 г.,BAR_SNACKS,,
7266,Даниссимо ягодный вкус105 г. Хрустящие шарики,4600605021781,pcs,580.00,Хрустящие шарики с ягодным вкусом в упаковке 105 г.,BAR_SNACKS,Даниссимо,
7269,Cornetto Ваниль-карамель 130 мл,8683130038185,pcs,690.00,Мороженое Cornetto с вкусом ванили и карамели в упаковке 130 мл.,BAR_SNACKS,Cornetto,
7272,Какос-Миндаль-Манго 345 мл,2500401750019,pcs,3720.00,"Мороженое с вкусом кокоса, миндаля и манго в упаковке 345 мл.",BAR_SNACKS,Magnat Mini,
7275,Мах TWISTER Гипноз 65 мл (30) 160 г,8683130038277,pcs,350.00,Мороженое Гипноз в упаковке 65 мл.,BAR_SNACKS,Мах TWISTER,
7278,Мороженое Гормол Лед Фрукт Махито,4870212861931,pcs,200.00,Мороженое с фруктовым вкусом Махито.,BAR_SNACKS,,
7281,Стакан Сибирское Ванильный вкус 70гр,4630053634721,pcs,375.00,Ванильное мороженое в упаковке 70 г.,BAR_SNACKS,Сибирское,
7284,Миша Трио экс мор шок.ван.клубн 80гр,4870233466357,pcs,400.00,Мороженое с шоколадным и клубничным вкусом в упаковке 80 г.,BAR_SNACKS,Миша Трио,
7287,Задняя четвертина КХК,2500403750017,kg,1400.00,"Мясная продукция, задняя четвертина.",BAR_SNACKS,,
7290,Мороженое Гормол Смородина 80гр,4870212681269,pcs,410.00,Мороженое со вкусом смородины.,BAR_SNACKS,Гормол,
7293,Творог Гормол 450гр,4870212681573,pcs,855.00,Творог с высоким содержанием белка.,BAR_SNACKS,Гормол,
7296,Пломбир с Мадагаскарской ваниль 65гр,8711327603523,pcs,340.00,Классический пломбир с добавлением ванили.,BAR_SNACKS,,
7299,Ведро Экзо Манго+Малина 520гр,4605922024149,pcs,2710.00,Мороженое с манго и малиной в ведре.,BAR_SNACKS,,
7302,Эскимо Золотой Стандарт пломбир с печеньем 61гр,4605922001270,pcs,430.00,Эскимо с пломбиром и печеньем.,BAR_SNACKS,,
7305,Эскимо Магнат Kis Шоколадный Трюфель 72гр,4605922024309,pcs,900.00,Шоколадное эскимо с трюфельной начинкой.,BAR_SNACKS,Магнат,
7308,Эскимо Экзо Арбуз+Дыня 70гр,4605922024354,pcs,630.00,Эскимо с арбузом и дыней.,BAR_SNACKS,,
7311,Эскимо Экзо Манго и Малина 70 г,4605922024385,pcs,630.00,Эскимо с манго и малиной.,BAR_SNACKS,,
7314,Брикет пломбир двойные сливки 80гр,4650068562048,pcs,405.00,Пломбир с двойными сливками в брикете.,BAR_SNACKS,,
7317,Стакан ваф Dessert пломб шок и пломбир 90гр,4650068565650,pcs,455.00,Вафельный стакан с пломбиром и шоколадом.,BAR_SNACKS,,
7320,Ведро пломб на сливках Сибхолод 450гр,4607065117290,pcs,1820.00,Пломбир на сливках в ведре.,BAR_SNACKS,Сибхолод,
7323,Миша пакет пломбир шоколад 400 г,4870233463219,pcs,1340.00,Пломбир шоколадный в упаковке.,BAR_SNACKS,,
7326,Эскимо Лили Мили молочн банан с нап малина 60гр,4630053636398,pcs,310.00,Эскимо с банановым вкусом и малиной.,BAR_SNACKS,,
7329,Эскимо круглое пломбир на двойн сливочках шок глаз 80гр*30,4650068562857,pcs,575.00,Круглое эскимо с пломбиром и шоколадной глазурью.,BAR_SNACKS,,
7332,Брикет ОЕ Шоколад Вишня пломбир 200гр,4630053637098,pcs,910.00,Пломбир с шоколадом и вишней в брикете.,BAR_SNACKS,,
7335,Трубочка сливочная Ваниль 80г,4630053636257,pcs,470.00,Сладкая трубочка с ванильным вкусом.,BAR_SNACKS,,
7338,Трубочка Коровка Лакомка Пломбир Ваниль 15% 90г,4602358009689,pcs,780.00,Трубочка с пломбиром и ванильным вкусом.,BAR_SNACKS,Коровка Лакомка,
7341,Мороженое Золотой Стандарт пломбир Черника 93г,4605922001737,pcs,600.00,Пломбир с черничным вкусом.,BAR_SNACKS,Золотой Стандарт,
7344,Эскимо Магнат Маскарпоне Голубика 74г,4605922003229,pcs,835.00,Эскимо с маскарпоне и голубикой.,BAR_SNACKS,Магнат,
7347,Филе цыплят-бройлеров Агро,2500409820011,kg,2425.00,Филе куриных бройлеров.,BAR_SNACKS,Агро,
7350,Голень УКПФ,2500501710012,kg,2065.00,Куриная голень.,BAR_SNACKS,УКПФ,
7353,Филе УКПФ,2500501740019,kg,2690.00,Куриное филе.,BAR_SNACKS,УКПФ,
7356,Magnat Mini Кокос-манго-миндаль Белый шок 345мл,8683130040423,pcs,3720.00,"Мороженое с кокосом, манго и миндалем.",BAR_SNACKS,Magnat,
7359,Мороженое Золотой Стандарт пломбир ЧКА 92г,4605922002024,pcs,745.00,Пломбир с шоколадным вкусом.,BAR_SNACKS,Золотой Стандарт,
7362,Мороженое Золотой Стандарт Конт трио 475г,4605922023951,pcs,3880.00,Мороженое с тремя вкусами.,BAR_SNACKS,Золотой Стандарт,
7365,Витаминная смесь 300г,745125165318,pcs,1560.00,Смесь витаминов для здоровья.,BAR_SNACKS,,
7368,Морской коктейль Мироторг,4607153854618,pcs,2380.00,Коктейль из морепродуктов.,BAR_SNACKS,Мироторг,
7371,Бомба конус XXL Клубника 145г*16,4870004909939,pcs,665.00,Клубничное мороженое в конусе.,BAR_SNACKS,,
7374,Эскимо Гормол шоколад 80г,4870212681290,pcs,865.00,Шоколадное эскимо.,BAR_SNACKS,Гормол,
7377,Эскимо Черника и Бабл Гам 60г,4630072804730,pcs,280.00,Эскимо с черникой и вкусом Бабл Гам.,BAR_SNACKS,,
7380,Трубочка Коровка Крем-брюле шоколад-слив 15% 90г,4602358009696,pcs,780.00,Трубочка с кремом брюле и шоколадно-сливочным вкусом.,BAR_SNACKS,Коровка,
7383,Мороженое Миша на полюсе пломбир шоколад 80г,4870233462083,pcs,435.00,Пломбир шоколадного вкуса в упаковке 80 г.,BAR_SNACKS,Миша,
7386,Стакан Вкусняшкино Черника 180г,4650068565933,pcs,600.00,Пластиковый стакан с черничным вкусом.,BAR_SNACKS,Вкусняшкино,
7389,Эскимо Dessert пломбир манго-малина 70г,4650068562772,pcs,580.00,Эскимо с пломбиром и вкусом манго и малины.,BAR_SNACKS,Dessert,
7392,Пломбир на двойных сливках 900г,2500507500013 4650068563113,pcs,2860.00,Пломбир с двойными сливками в упаковке 900 г.,BAR_SNACKS,,
7395,Рожок Snackup Манго-апельсин молочный,4630053634783,pcs,440.00,Молочный рожок с манго и апельсином.,BAR_SNACKS,Snackup,
7398,Мороженое Коровка пломбир ваниль 400г,4602358003823,pcs,2490.00,Пломбир ванильного вкуса в упаковке 400 г.,BAR_SNACKS,Коровка,
7401,Мороженое Коровка пломбир крем-брюле 400г,4602358003830,pcs,2225.00,Пломбир крем-брюле в упаковке 400 г.,BAR_SNACKS,Коровка,
7404,Коровка из кореновки пломбир с фисташками 15% 80г,4602358008224,pcs,790.00,Пломбир с фисташками в упаковке 80 г.,BAR_SNACKS,Коровка,
7407,Эскимо Ленинградское 15% 90г,4660013331421,pcs,715.00,Эскимо с 15% жирности в упаковке 90 г.,BAR_SNACKS,,
7410,Контейнер Золотой Стандарт 100% натур. черника 475г,465922023968,pcs,1735.00,Контейнер с натуральной черникой в упаковке 475 г.,BAR_SNACKS,,
7413,Пинта Магнат MOVIE Соленая карамель 260г,2500709160015,pcs,1840.00,Пинта мороженого со вкусом соленой карамели в упаковке 260 г.,BAR_SNACKS,Магнат,
7416,Миша Ванна мороженое с заменителем жира клубника 12% 490г,4870233466593,pcs,2410.00,Мороженое с клубничным вкусом и заменителем жира в упаковке 490 г.,BAR_SNACKS,Миша,
