global_row,name,barcode,quantityUnitType,salesPrice,productDesc,category,brand,productImg
2463,Томатная паста Барские томаты 500гр,4870235040241,pcs,1135.00,Томатная паста для приготовления блюд.,BAR_CLEANING,Барские томаты,
2466,Влажные салфетки Loli Зеленый чай,4870105000481,pcs,165.00,Влажные салфетки с ароматом зеленого чая.,BAR_CLEANING,Loli,
2469,Dove жидкое крем-мыло Нежный уход для рук 250 мл,8934868185598,pcs,1140.00,Жидкое крем-мыло для нежного ухода за руками.,BAR_CLEANING,Dove,
2472,"Комарофф Фэрозоль 3в1 от комаров, мошек и клещей 100 мл",4602666702708,pcs,1860.00,Фэрозоль для защиты от насекомых.,BAR_CLEANING,Комарофф,
2475,Зубная щетка Colgate Extra Density жесткая,8718951508927,pcs,1110.00,Зубная щетка с жесткой щетиной для качественной чистки зубов.,BAR_CLEANING,Colgate,
2478,Средство для мытья посуды SYNERGETIC Яблоко 0.5 л,4623721671449,pcs,1295.00,Эффективное средство для мытья посуды с ароматом яблока.,BAR_CLEANING,SYNERGETIC,
2481,Средство для мытья посуды SYNERGETIC Лимон 0.5 л,2500703330018,pcs,1295.00,Эффективное средство для мытья посуды с ароматом лимона.,BAR_CLEANING,SYNERGETIC,
2484,Шампунь Эльсев Ультра прочность 250 мл,3600523931538,pcs,1685.00,Шампунь для укрепления волос с эффектом ультра прочности.,BAR_CLEANING,Эльсев,
2487,Бальзам Эльсев Ультра прочность 200 мл,3600523931491,pcs,1685.00,Бальзам для укрепления волос с эффектом ультра прочности.,BAR_CLEANING,Эльсев,
2490,Бальзам Эльсев Ультра прочность 200 мл,2500703450013,pcs,1715.00,Бальзам для укрепления волос с эффектом ультра прочности.,BAR_CLEANING,Эльсев,
2493,Гигиенические прокладки Nova 10 шт,5900516306748,pcs,585.00,Гигиенические прокладки для ежедневного использования.,BAR_CLEANING,Nova,
2496,Гигиенические прокладки Perfecta Ultra Maxi Blue 8 шт,59005163059556,pcs,885.00,Гигиенические прокладки Ultra Maxi для максимального комфорта.,BAR_CLEANING,Perfecta,
2499,Ежедневные вкладки Panty Soft 50 шт + 10 (Россия),5900516312084,pcs,1070.00,Ежедневные гигиенические вкладки для комфорта и защиты.,BAR_CLEANING,Panty,
2502,Ватные подушечки для снятия макияжа 100 шт,5900516403744,pcs,730.00,Ватные подушечки для удобного снятия макияжа.,BAR_CLEANING,,
2505,Ватные палочки 100 шт,5900516403638,pcs,340.00,Ватные палочки для личной гигиены.,BAR_CLEANING,,
2508,Ополаскиватель FLO FLO Pure Provence 1 л,5900948241037,pcs,1360.00,Ополаскиватель для рта с ароматом Прованса.,BAR_CLEANING,FLO,
2511,Ополаскиватель концентрированный FLO Pure Perfume TUBEROSE 1 л,5900948241679,pcs,1805.00,Концентрированный ополаскиватель с ароматом туберозы.,BAR_CLEANING,FLO,
2514,Влажные салфетки Flovell Care Anatlia 54 шт,745114229861,pcs,375.00,Влажные салфетки для ухода за кожей.,BAR_CLEANING,Flovell,
2517,Набор Черный Жемчуг: пенка для умывания + крем для лица SPF 150 48 мл,8720633013551,pcs,5315.00,Набор для ухода за кожей лица с защитой от солнца.,BAR_CLEANING,Черный Жемчуг,
2520,Набор ЧЛ Ежедневный уход 100 мл,4605922033028,pcs,2665.00,Набор для ежедневного ухода.,BAR_CLEANING,,
2523,Салфетки влажные DARA 15 шт Ромашка,4870202941014,pcs,150.00,Влажные салфетки с ароматом ромашки.,BAR_CLEANING,DARA,
2526,Салфетка ECOLUX Лучшая цена желтая 5 шт,4600590914440,pcs,540.00,Салфетки желтого цвета по выгодной цене.,BAR_CLEANING,ECOLUX,
2529,Прокладки Diana Ultra thin daily pad long 32 шт,8690879302378,pcs,1000.00,Тонкие ежедневные прокладки.,BAR_CLEANING,Diana,
2532,Прокладки Diana Ultra thin NIGHT 6 шт,8690879300084,pcs,725.00,Ночные тонкие прокладки.,BAR_CLEANING,Diana,
2535,Детский шампунь SEPTIVIT для девочек 1 л,4631170800488,pcs,1900.00,Шампунь для девочек с нежным уходом.,BAR_CLEANING,SEPTIVIT,
2538,Шампунь NICE by SEPTIVIT для всех типов волос 1 л,4631164256611,pcs,1790.00,Шампунь для всех типов волос.,BAR_CLEANING,SEPTIVIT,
2541,Освежитель воздуха GREEN COLLECTION Крымские каникулы 300 мл,4620029241633,pcs,645.00,Освежитель воздуха с ароматом Крымских каникул.,BAR_CLEANING,GREEN COLLECTION,
2544,Крем интенсивное увлажнение Nivea Soft 200 мл,4005900008411,pcs,3165.00,Крем для интенсивного увлажнения кожи.,BAR_CLEANING,Nivea,
2547,Бальзам для губ Аква уход SPF15 Nivea,4005900996091,pcs,1280.00,Бальзам для губ с защитой SPF15.,BAR_CLEANING,Nivea,
2550,Бальзам для губ Вишневое сияние Nivea,4005900996053,pcs,1280.00,Бальзам для губ с вишневым ароматом.,BAR_CLEANING,Nivea,
2553,Антиперспирант Aretic ocean Nivea Men,4005900669032,pcs,2190.00,Антиперспирант с морским ароматом.,BAR_CLEANING,Nivea,
2556,Гель для душа Увлажнение и забота 500 мл,4005808285785,pcs,2380.00,Гель для душа с увлажняющим эффектом.,BAR_CLEANING,,
2559,Гель для душа Сила Угля Nivea Men 500 мл,4005900123824,pcs,2640.00,Гель для душа с угольным экстрактом.,BAR_CLEANING,Nivea,
2562,Гель для душа СПОРТ 500 мл,4005900054340,pcs,2640.00,Гель для душа для активных людей.,BAR_CLEANING,,
2565,Средство для мытья посуды MR.GREEN Арбуз 500 мл,4630164772930,pcs,1000.00,Эффективное средство для мытья посуды с ароматом арбуза.,BAR_CLEANING,MR.GREEN,
2568,Средство для мытья посуды MR.GREEN Яблоко 500 мл,4630164772954,pcs,1000.00,Эффективное средство для мытья посуды с ароматом яблока.,BAR_CLEANING,MR.GREEN,
2571,Гель для душа Сочный Персик 460 мл,4610152390254,pcs,1770.00,Гель для душа с ароматом сочного персика.,BAR_CLEANING,,
2574,Гель для душа Экзотическое Манго 460 мл,4610152390193,pcs,1770.00,Гель для душа с ароматом экзотического манго.,BAR_CLEANING,,
2577,Шампунь Aromatic Herbs Розмарин и Красный Клевер 400 мл,4812941003394,pcs,1510.00,Шампунь с экстрактами розмарина и красного клевера.,BAR_CLEANING,Aromatic Herbs,
2580,Кондиционер для волос Грейпфрут и Маракуйя 500 мл,4810304018337,pcs,1535.00,Кондиционер для волос с ароматами грейпфрута и маракуйи.,BAR_CLEANING,,
2583,Туалетная бумага 4 рулона в упаковке Пикник,4870007300702,pcs,650.00,Туалетная бумага в упаковке по 4 рулона.,BAR_CLEANING,,
2586,Ополаскиватель полости рта EXXE Экстра свежесть (Голубой) 250 мл,4620739975804,pcs,780.00,Ополаскиватель для рта с эффектом экстра свежести.,BAR_CLEANING,EXXE,
2589,SYNERGETIC соль для посудомоечных машин 750гр,4607971450566,pcs,1555.00,"Соль для посудомоечных машин, 750 г.",BAR_CLEANING,SYNERGETIC,
2592,SYNERGETIC Средство для мытья посуды биоразлагаемое Гранат 1 л,4607971450764,pcs,2280.00,Биоразлагаемое средство для мытья посуды с ароматом граната.,BAR_CLEANING,SYNERGETIC,
2595,Шампунь Clear Мужской Против перхоти с экстрактом лимона 180 мл,6281006604926,pcs,1435.00,Шампунь против перхоти с экстрактом лимона.,BAR_CLEANING,Clear,
2598,Шампунь Clear Мужской Гель для тела и лица 3 в 1 VITA ABE 380 мл,6281006605183,pcs,2295.00,Гель для тела и лица 3 в 1 с ароматом VITA ABE.,BAR_CLEANING,Clear,
2601,Средство для мытья посуды FAIRY Мандарин 650 мл,8700216696722,pcs,1100.00,Средство для мытья посуды с ароматом мандарина.,BAR_CLEANING,FAIRY,
2604,Фольга алюминиевая Master FRESH 8 метров,4620739975798,pcs,400.00,"Алюминиевая фольга, 8 метров.",BAR_CLEANING,Master FRESH,
2607,Соль BINMED PINK SALT SOFT RU - CIS (23) + UZ/AZ/BY,7640168938413,pcs,735.00,Соль для ванн BINMED PINK SALT SOFT.,BAR_CLEANING,BINMED,
2610,Детская зубная щетка JUICY LAB Магия единорога с ионами серебра,7640168934811 7640168935665,pcs,970.00,Зубная щетка с ионами серебра для детей.,BAR_CLEANING,JUICY LAB,
2613,Зубная паста Lacalut Flora 75 мл,4016369662533,pcs,1515.00,Зубная паста с экстрактом флоры.,BAR_CLEANING,Lacalut,
2616,Зубная паста Lacalut White 75 мл,4016369856123,pcs,1515.00,Отбеливающая зубная паста.,BAR_CLEANING,Lacalut,
2619,Зубная паста Lacalut Kids 50 мл 4 л,4016369666661,pcs,1330.00,Зубная паста для детей.,BAR_CLEANING,Lacalut,
2622,Зубная паста Lacalut Kids 50 мл + 8 л,4016369666685,pcs,1165.00,Зубная паста для детей с дополнительным объемом.,BAR_CLEANING,Lacalut,
2625,Соль для посудомоечных машин FINISH 1.5 кг,8690570532067,pcs,1715.00,Соль для посудомоечных машин.,BAR_CLEANING,FINISH,
2628,Отбеливатель для тканей VANISH гель 500 мл,8682539004913,pcs,1520.00,Гель-отбеливатель для тканей.,BAR_CLEANING,VANISH,
2631,Мочалка из ПП нити,4870238561538,pcs,570.00,Мочалка из полипропиленовой нити.,BAR_CLEANING,,
2634,Ватные палочки Wikky п/э 200 шт,4630209230128,pcs,580.00,Ватные палочки в упаковке 200 штук.,BAR_CLEANING,Wikky,
2637,"Лимонад ""Золотое кольцо"" Мохито 1,0 л",4870235042788,pcs,475.00,Лимонад со вкусом мохито.,BAR_CLEANING,Золотое кольцо,
2640,Ju-Ju-Juv Фруктовое ассорти 70 г,4607041456764,pcs,220.00,Фруктовое ассорти в упаковке 70 г.,BAR_CLEANING,Ju-Ju-Juv,
2643,REXONA MEN Аэрозоль Антиперспирант Свежесть Лайма 150 мл,8683130070116,pcs,1595.00,Антиперспирант в аэрозольной упаковке.,BAR_CLEANING,REXONA MEN,
2646,Мыло АМК натур для всей семьи Глицериновое 180 г,4600528353808,pcs,455.00,Глицериновое мыло для всей семьи.,BAR_CLEANING,АМК,
2649,Пятновыводитель для тканей VANISH Мультисила гель 1000 мл,8690570546989,pcs,3490.00,Гель-пятновыводитель для тканей.,BAR_CLEANING,VANISH,
2652,Средство для смягчения воды и предотвращения образования известкового налета Calgon 4 в 1 гель 500 мл,8002910063320,pcs,2910.00,Гель для смягчения воды и предотвращения налета.,BAR_CLEANING,Calgon,
2655,Чистящее средство для кухни CILLIT BANG Антижир + Сияние спрей 750 мл,8690570522556,pcs,3275.00,Эффективное средство для удаления жира и загрязнений на кухне.,BAR_CLEANING,CILLIT BANG,
2658,Бритва GILLETTE FUSION с 1 кассетой и чехлом,8700216589079,pcs,4835.00,Бритва с инновационной системой для комфортного бритья.,BAR_CLEANING,GILLETTE,
2661,Шампунь PPV 250 мл + Бальзам Agua Light 200 мл,8001090953186,pcs,2585.00,Шампунь и бальзам для волос в комплекте.,BAR_CLEANING,,
2664,Шампунь 2в1 Освежающий 200 мл + Пена для бритья GILLETTE 200 мл,8700216593106,pcs,2610.00,Шампунь и пена для бритья в одном наборе.,BAR_CLEANING,,
2667,Твёрдый дезодорант OS WT 50 мл + Гель для душа WT 250 мл,8700216131803,pcs,2800.00,Дезодорант и гель для душа в комплекте.,BAR_CLEANING,,
2670,Мыло Palmolive Натурэль Лепестки Роз 150 г,8693495052740,pcs,790.00,Мыло с экстрактом лепестков роз для нежного ухода.,BAR_CLEANING,Palmolive,
2673,Зубная паста SYNERGETIC ULTRA WHITE отбеливающая 240 г,4607971456025,pcs,1905.00,Отбеливающая зубная паста для яркой улыбки.,BAR_CLEANING,SYNERGETIC,
2676,Антиперспирант Nivea Men Невидимый Fresh,4005900379313,pcs,2190.00,Антиперспирант для мужчин с эффектом невидимости.,BAR_CLEANING,Nivea Men,
2679,Крем для рук Мультиуход с натуральным соком арбуза 75 мл,4650062123221,pcs,680.00,Крем для рук с увлажняющим эффектом.,BAR_CLEANING,,
2682,Прокладки OLA SS Classic wings singles NORMAL 10 шт,4680007634024,pcs,730.00,Прокладки с крылышками для комфортного использования.,BAR_CLEANING,OLA,
2685,Прокладки OLA! NORMAL SINGLES Солнечная Ромашка 9 шт,4680007633607,pcs,730.00,Прокладки с ароматом ромашки для ежедневного использования.,BAR_CLEANING,OLA,
2688,Мыло Sovia Aloe Vera140гр,4780120510646,pcs,365.00,Мыло с экстрактом алоэ вера для мягкого очищения.,BAR_CLEANING,Sovia,
2691,Шампунь Sovia Sei Yume 750 мл,4780120511476,pcs,1755.00,Шампунь для волос с увлажняющим эффектом.,BAR_CLEANING,Sovia,
2694,Шампунь Hyal Увлажняющий 400 мл,4780120511087,pcs,720.00,Увлажняющий шампунь для сухих волос.,BAR_CLEANING,Hyal,
2697,Шампунь Hyal Tiffany Blue 400 мл,4780120511070,pcs,720.00,Шампунь с уникальным ароматом Tiffany Blue.,BAR_CLEANING,Hyal,
2700,Бальзам Doctor S Power Oil 500 мл,4780028220333,pcs,985.00,Бальзам с маслами для ухода за волосами.,BAR_CLEANING,Doctor S,
2703,Таза Курт Классик Зелен 50 шт,4700026510052,pcs,80.00,Классические зеленые тазики для сервировки.,BAR_CLEANING,Курт,
2706,Вода TASSAY газ 1 л,48700071000133 4870071000133,pcs,470.00,Газированная вода TASSAY в упаковке 1 литр.,BAR_BEVERAGES,TASSAY,
2709,"Вода TASSAY негаз 0,25 л",4870071003806,pcs,290.00,"Негазированная вода TASSAY в упаковке 0,25 литра.",BAR_BEVERAGES,TASSAY,
2712,"Вода TASSAY со вкусом лимона негаз 0,5 л",4870234680226,pcs,400.00,"Негазированная вода TASSAY со вкусом лимона, 0,5 литра.",BAR_BEVERAGES,TASSAY,
2715,Вода TASSAY со вкусом клубники негаз 1 л,4870234680349,pcs,500.00,"Негазированная вода TASSAY со вкусом клубники, 1 литр.",BAR_BEVERAGES,TASSAY,
2718,Вода TASSAY со вкусом манго и персика негаз 1 л,4870234680950,pcs,510.00,"Негазированная вода TASSAY со вкусом манго и персика, 1 литр.",BAR_BEVERAGES,TASSAY,
2721,"Вода минеральная Набеглави 0,5 л",4865602000058,pcs,495.00,"Минеральная вода Набеглави в упаковке 0,5 литра.",BAR_BEVERAGES,Набеглави,
2724,"Вода негаз. Клубника Sevens 0,5 л",4870202522640,pcs,250.00,"Негазированная клубничная вода Sevens, 0,5 литра.",BAR_BEVERAGES,Sevens,
2727,Вода негаз. Манго и маракуйя Sevens 1 л,4870202522602,pcs,295.00,"Негазированная вода Sevens со вкусом манго и маракуйи, 1 литр.",BAR_BEVERAGES,Sevens,
2730,Минеральная вода Боржоми 1 л,4860019001360,pcs,925.00,Минеральная вода Боржоми в упаковке 1 литр.,BAR_BEVERAGES,Боржоми,
2733,"Минеральная вода Боржоми 0,5 л",4860019001346,pcs,740.00,"Минеральная вода Боржоми в упаковке 0,5 литра.",BAR_BEVERAGES,Боржоми,
2736,Вода TASSAY не газ 1 л,4870071000218,pcs,470.00,Негазированная вода TASSAY в упаковке 1 литр.,BAR_BEVERAGES,TASSAY,
2739,Вода БОНАКВА газ 500 мл × 2,90494406,pcs,300.00,Газированная вода БОНАКВА в упаковке 500 мл × 2.,BAR_BEVERAGES,БОНАКВА,
2742,Вода БОНАКВА НЕГАЗ ПЭТ 1Лх12,5449000005489,pcs,420.00,Негазированная вода БОНАКВА в упаковке 1 литр × 12.,BAR_BEVERAGES,БОНАКВА,
2745,"Верони Малина 0,5 л",4870144474861,pcs,275.00,Минеральная вода с малиновым вкусом.,BAR_BEVERAGES,,
2748,Вода A'SU Stil негаз 1 л,4870001159955,pcs,370.00,Негазированная вода.,BAR_BEVERAGES,,
2751,Вода A'SU Stil негаз со вкусом манго-грейпфрут 1 л,4870002329159,pcs,510.00,Негазированная вода со вкусом манго и грейпфрута.,BAR_BEVERAGES,,
2754,"Вода A'SU Stil негаз со вкусом лимона 0,5 л",4870002325441,pcs,300.00,Негазированная вода со вкусом лимона.,BAR_BEVERAGES,,
2757,"Вода A'SU Негаз 0,5 л Клубника-киви",4870001571023,pcs,300.00,Негазированная вода со вкусом клубники и киви.,BAR_BEVERAGES,,
2760,Вода A'SU Stil негаз со вкусом мяты 1 л,4870002328398,pcs,415.00,Негазированная вода со вкусом мяты.,BAR_BEVERAGES,,
2763,"Вода A'SU Stil негаз со вкусом мяты 1,5 л",4870002329135,pcs,500.00,Негазированная вода со вкусом мяты.,BAR_BEVERAGES,,
2766,"Вода A'SU Газ 0,5 л Клубника-киви",4870001571047,pcs,280.00,Газированная вода со вкусом клубники и киви.,BAR_BEVERAGES,,
2769,Вода A'SU Газ 1 л Клубника-киви,4870001571054,pcs,385.00,Газированная вода со вкусом клубники и киви.,BAR_BEVERAGES,,
2772,"Вода A'SU Stil газ 1,5 л",4870001157920,pcs,410.00,Газированная вода.,BAR_BEVERAGES,,
2775,Вода A'SU Негаз 8 л,4870002328886,pcs,1100.00,Негазированная вода.,BAR_BEVERAGES,,
2778,Вода A'SU Stil негаз со вкусом манго-грейпфрут 1 л,2500305930012,pcs,,Негазированная вода со вкусом манго и грейпфрута.,BAR_BEVERAGES,,
2781,"Минеральная вода ALEX Saryagash газ 1,5 л",4870073000018,pcs,360.00,Газированная минеральная вода.,BAR_BEVERAGES,ALEX,
2784,"Минеральная вода ALEX Saryagash негаз 0,5 л",4870073000254,pcs,205.00,Негазированная минеральная вода.,BAR_BEVERAGES,ALEX,
2787,"Вода СП Limonata 0,33 л",8002270766886,pcs,1040.00,Вода со вкусом лимона.,BAR_BEVERAGES,СП,
2790,"Вода минеральная Turan 1,5 л газированная",4870031001286,pcs,315.00,Минеральная вода с газом.,BAR_BEVERAGES,Turan,
2793,"Вода минеральная Qulager-Burrabay 1,5 л газированная",4870031008117,pcs,735.00,Минеральная вода с газом.,BAR_BEVERAGES,Qulager-Burrabay,
2796,Вода минеральная Turan 1 л газированная,4870031001873,pcs,365.00,Минеральная вода с газом.,BAR_BEVERAGES,Turan,
2799,"Вода минеральная Turan 1,5 л негазированная",4870031001866,pcs,315.00,Минеральная вода без газа.,BAR_BEVERAGES,Turan,
2802,"Veroni Mineral Манго-Ананс 0,5 л н/г",4870144476681,pcs,275.00,Минеральный напиток со вкусом манго и ананаса.,BAR_BEVERAGES,Veroni,
2805,"Напиток Laimon Fresh max 0,5 л",46147110,pcs,425.00,Освежающий лимонный напиток.,BAR_BEVERAGES,Laimon Fresh,
2808,Вода TASSAY негазированная 750 мл с/б,4870071003844,pcs,1085.00,Негазированная вода в стеклянной бутылке.,BAR_BEVERAGES,TASSAY,
2811,Вода TASSAY со вкусом клубники газ 1 л п/б,4870234680332,pcs,500.00,Газированная вода со вкусом клубники.,BAR_BEVERAGES,TASSAY,
2814,Вода A`SU Негаз 1 л Малина-арбуз 12%,4870001572693,pcs,415.00,Негазированная вода со вкусом малины и арбуза.,BAR_BEVERAGES,A`SU,
2817,"Вода минеральная Turan 0,5 л негаз лимон-мята",4870031009756,pcs,275.00,Минеральная вода без газа со вкусом лимона и мяты.,BAR_BEVERAGES,Turan,
2820,Вода минеральная Turan 1 л негаз лимон-мята,4870031009794,pcs,335.00,Минеральная вода без газа со вкусом лимона и мяты.,BAR_BEVERAGES,Turan,
2823,"Вкусовая вода СП Melograno Arancia 0,33 л ж/б",8002270866883,pcs,1040.00,Вода со вкусом граната и апельсина в жестяной банке.,BAR_BEVERAGES,Melograno,
2826,Кукуруза сахарная 425 мл MIKADO,4007415005404,pcs,715.00,Сахарная кукуруза в консервированном виде.,BAR_BEVERAGES,MIKADO,
2829,Шампиньоны целые 425 мл MIKADO,4007415005763,pcs,1215.00,Целые шампиньоны в консервированном виде.,BAR_BEVERAGES,MIKADO,
2832,"Дена Нектар Ананас-Яблоко 1,0 л",4780016370620,pcs,1115.00,Нектар со вкусом ананаса и яблока.,BAR_BEVERAGES,Дена,
2835,"Вода TASSAY газ 0,777 л",4870071005374,pcs,365.00,Газированная вода TASSAY в удобной упаковке.,BAR_BEVERAGES,TASSAY,
2838,"Дена Томатный сок 1,0 л",4780016370064,pcs,810.00,Сочный томатный сок в упаковке 1 литр.,BAR_BEVERAGES,Дена,
2841,Вода Arzu Life лимон 1 л,4870200193064,pcs,200.00,Вода с лимонным вкусом Arzu Life в упаковке 1 литр.,BAR_BEVERAGES,Arzu Life,
2844,Нектар Гранатовый 3 л,4700000612024,pcs,2570.00,Гранатовый нектар в упаковке 3 литра.,BAR_BEVERAGES,,
2847,Сок Томатный 3 л,4700000612093,pcs,2915.00,Томатный сок в упаковке 3 литра.,BAR_BEVERAGES,,
2850,Сок Яблочный 3 л,4700000611973,pcs,3170.00,Яблочный сок в упаковке 3 литра.,BAR_BEVERAGES,,
2853,"Сок Фруктовый сад Яблоко 0,95 л",4601201017994,pcs,720.00,"Фруктовый сок с яблоком в упаковке 0,95 литра.",BAR_BEVERAGES,Фруктовый сад,
2856,"Сок Фруктовый сад Яблоко черника 0,95 л",4600494665424,pcs,665.00,"Сок с яблоком и черникой в упаковке 0,95 литра.",BAR_BEVERAGES,Фруктовый сад,
2859,"Сок Фруктовый сад Мультифрукт 1,93 л",4601201017734,pcs,1235.00,"Мультифруктовый сок в упаковке 1,93 литра.",BAR_BEVERAGES,Фруктовый сад,
